[
  {
    "id": 1,
    "nome": "sair",
    "contato": {
      "telefone": "1298554578",
      "email": "jhsjsjs@jhjkhkj.com"
    },
    "nivel": "sr",
    "area": "produto",
    "produto_negocio": "consultoria, fintech, startup",
    "tecnologias": "nodeJS",
    "experiencias": "xp com IA",
    "formacao": "psicolohia",
    "disponibilidade": "integral",
    "tipo_vaga": "remoto",
    "modelo_contratacao": "pj",
    "salario": "10k",
    "linkedin": "...",
    "resumo": "👤 Olá! Aqui está o perfil de sair:\n\n📍 Localidade: Localidade não informada\n📞 Telefone: 1298554578\n📧 E-mail: jhsjsjs@jhjkhkj.com\n🔗 LinkedIn/Portfólio: ...\n\n💼 Nível profissional: sr\n🧠 Área de atuação: produto\n🏢 Tipo de produto ou negócio: consultoria, fintech, startup\n🛠️ Tecnologias e ferramentas: nodeJS\n\n📈 Experiências anteriores:\nxp com IA\n\n🎓 Formação acadêmica e certificações:\npsicolohia\n\n🕐 Disponibilidade: integral\n📌 Modalidade de trabalho: remoto\n📄 Tipo de contratação desejada: pj\n💰 Pretensão salarial: Não autorizada para exibição\n\nEsse perfil foi gerado pela Maya com base nas respostas do(a) candidato(a)."
  }
]